{"protocol":"GRIDWORKS-COMMERCIAL-UX-TEXT-PLAN-JUDGMENT-v1","judgeRunId":"candidate-text-v2-sol-ultra-r03","judgeSlot":"SOL-ULTRA","model":"gpt-5.6-sol","reasoningEffort":"ultra","textPlanSha256":"sha256:8e63340c123862d827e5c85926cbd6ac868eac93308a40f5825fe4b9ff37315c","promptTemplateSha256":"sha256:d31481546619063fcba5193d7c9043c5bb7e620d258ad3a6bc726fead6ff3be9","judgmentSchemaSha256":"sha256:69eb5143bc4821b14b90aa479da21620ddfffb20b63070d580184dfe35e69c04","cells":[{"cellId":"TP-J1","label":"EXCELLENT","confidence":"HIGH","strengthEvidence":[{"sourceRef":"chapter:FIRST_LIGHT:learningIntent","observation":"첫 장은 접속점 선택, 선로 계획, 승인, 통전 확인으로 기본 건설 흐름을 시작한다."},{"sourceRef":"chapter:LONGEST_NIGHT:learningIntent","observation":"마지막 장은 최대수요, 비상 운전, 보호정지, 범람과 전원 상실을 결합해 앞선 학습과 선택을 종합한다."}],"gapEvidence":[]},{"cellId":"TP-J2","label":"EXCELLENT","confidence":"HIGH","strengthEvidence":[{"sourceRef":"LONGEST_NIGHT/result/keep","observation":"결과가 지킨 산업 약속과 필수 공급, 비상 운전·보호정지·범람을 통과한 실제 망을 함께 회수한다."},{"sourceRef":"campaign/epilogue","observation":"에필로그가 여덟 임무의 의무, 약속, 발전원, 경로, 비상 운전과 자금을 보존하고 원하는 장의 시작 상태에서 재시험할 수 있다고 명시한다."}],"gapEvidence":[]},{"cellId":"TP-T1","label":"STRONG","confidence":"MEDIUM","strengthEvidence":[{"sourceRef":"chapter:FIRST_LIGHT:learningIntent","observation":"자유 배치, 실제 선로 경로, 연속 한계와 계획 상태에서 통전 상태로의 전환까지 학습 항목과 순서가 구체적이다."},{"sourceRef":"FIRST_LIGHT/briefing","observation":"강 위 설비를 피하고 육지 접속점 사이에 동부 생활권의 첫 공급 경로를 만들라는 초기 과제가 분명하다."}],"gapEvidence":[{"sourceRef":"FIRST_LIGHT/briefing","observation":"단계별 안내를 제공한다고 말하지만 각 선택·계획·승인·통전 단계의 실제 안내 문구나 교정 문구는 제시하지 않는다."}]},{"cellId":"TP-T2","label":"STRONG","confidence":"MEDIUM","strengthEvidence":[{"sourceRef":"SECOND_HEART/briefing","observation":"건설·조작 순서를 반복하지 않고 북안과 강변 회랑을 차례로 차단해 실제 잔존 경로를 확인한다는 범위가 명확하다."},{"sourceRef":"chapter:SECOND_HEART:learningIntent","observation":"같은 위험 회랑을 공유한 두 선은 독립 경로가 아니라는 핵심 모델을 직접 규정한다."}],"gapEvidence":[{"sourceRef":"SECOND_HEART/briefing","observation":"두 차단시험의 개별 진행 안내나 실패 시 교정 문구는 별도 작성되어 있지 않다."}]},{"cellId":"TP-T3","label":"EXCELLENT","confidence":"HIGH","strengthEvidence":[{"sourceRef":"SECOND_SOURCE/window/SECOND_SOURCE_BUILD","observation":"발전량이 남아도 경로의 한 접속부가 차면 공급이 성립하지 않는다는 병목 모델과 확인 대상을 명시한다."},{"sourceRef":"SECOND_SOURCE/result/standard","observation":"인수시험 종료와 함께 건설·조작 및 경로시험 안내를 끝내고 이후에도 남는 목표·의무·약속·예보를 구체적으로 구분한다."}],"gapEvidence":[]},{"cellId":"TP-C1","label":"STRONG","confidence":"HIGH","strengthEvidence":[{"sourceRef":"FIRST_LIGHT/briefing","observation":"강을 피하고 육지 접속점을 이어 전기가 없던 동부 생활권에 첫 실제 공급 경로를 완성하게 한다."},{"sourceRef":"FIRST_LIGHT/result/standard","observation":"첫 점등과 함께 놓은 경로가 이후 공사에도 남는다는 지속성을 결과에서 확인한다."}],"gapEvidence":[{"sourceRef":"FIRST_LIGHT/briefing","observation":"첫 경로에 사용할 발전원이나 접속점의 구체적 식별자는 작성된 본문에 없다."}]},{"cellId":"TP-C2","label":"EXCELLENT","confidence":"HIGH","strengthEvidence":[{"sourceRef":"chapter:SECOND_HEART:learningIntent","observation":"공유 위험 회랑과 독립 경로를 구별하고 서로 다른 회랑 차단 뒤 의료원까지 실제 경로가 남아야 한다고 정의한다."},{"sourceRef":"SECOND_HEART/result/standard","observation":"두 차단시험의 무정전 성공과 각 시험에서 실제로 남은 경로의 기록을 결과로 닫는다."}],"gapEvidence":[]},{"cellId":"TP-C3","label":"EXCELLENT","confidence":"HIGH","strengthEvidence":[{"sourceRef":"SECOND_SOURCE/briefing","observation":"남부 전원을 합류시킨 뒤 서부 전원을 제외하고 연속 한계만 사용하는 인수시험 조건이 명확하다."},{"sourceRef":"SECOND_SOURCE/window/SECOND_SOURCE_BUILD","observation":"두 시설의 전체 실제 경로와 최소 열여유를 함께 확인하도록 해 발전량과 경로 병목을 분리한다."}],"gapEvidence":[]},{"cellId":"TP-C4","label":"EXCELLENT","confidence":"HIGH","strengthEvidence":[{"sourceRef":"WHOSE_MARGIN/window/AFTER_HEAT_SAFETY","observation":"비상 운전 설비의 다음 경계 보호정지와 그 뒤 아침 안전 의무의 잔존 경로를 연속된 결과로 제시한다."},{"sourceRef":"BEFORE_WATER_REACHES/window/FLOOD_BYPASS_BUILD","observation":"범람 통제선 안 설비의 전면 정지와 지도상 사용 불가 표시, 실제 공급 경로 확인을 결합한다."},{"sourceRef":"SHUT_DOWN_TO_KEEP/briefing","observation":"3주 뒤 열 상태 복귀를 명시한 다음 서부 전원 계획정지 중 남부 경로만으로 운영하는 새 조건으로 전환한다."}],"gapEvidence":[]},{"cellId":"TP-C5","label":"STRONG","confidence":"HIGH","strengthEvidence":[{"sourceRef":"LONGEST_NIGHT/result/keep","observation":"지킨 약속과 필수 공급, 복합 경계를 통과한 실제 망을 함께 기록한다."},{"sourceRef":"LONGEST_NIGHT/result/defer","observation":"미룬 산업 약속과 의료원·정수장을 지킨 실제 망을 대안 결과로 분리한다."}],"gapEvidence":[{"sourceRef":"LONGEST_NIGHT/result/keep","observation":"실제 망을 기록한다고만 표현해 최종 잔존 발전원, 경로 또는 여유의 구체 항목은 결과 본문에 열거하지 않는다."}]},{"cellId":"TP-A1","label":"STRONG","confidence":"HIGH","strengthEvidence":[{"sourceRef":"chapter:FIRST_LIGHT:choiceIntent","observation":"강을 피하는 경로 선택에 공사비와 공사시간을 함께 감당하도록 선택 축을 명시한다."},{"sourceRef":"chapter:BEFORE_WATER_REACHES:choiceIntent","observation":"짧고 위험한 보강과 더 비싸거나 긴 안전 회랑을 직접 대비한다."}],"gapEvidence":[{"sourceRef":"BEFORE_WATER_REACHES/briefing","observation":"작성된 플레이어 본문은 일반선과 보강선의 위험 차이는 설명하지만 비용과 공사시간의 상대 규모는 제시하지 않는다."}]},{"cellId":"TP-A2","label":"EXCELLENT","confidence":"HIGH","strengthEvidence":[{"sourceRef":"NORTH_BANK_PROMISE/briefing","observation":"정수장 필수 공급을 고정한 채 북안 약속 여부와 다음 더운 저녁을 위한 접속부 여유를 함께 선택하게 한다."},{"sourceRef":"NORTH_BANK_PROMISE/result/defer","observation":"약속을 미룬 결과가 남은 망과 자금의 다음 장 이월로 구체적으로 이어진다."}],"gapEvidence":[]},{"cellId":"TP-A3","label":"EXCELLENT","confidence":"HIGH","strengthEvidence":[{"sourceRef":"WHOSE_MARGIN/briefing","observation":"산업 증산을 위해 한 번뿐인 비상 열여유를 쓰면 다음 안전 경계에서 해당 설비가 보호정지한다는 대가가 명확하다."},{"sourceRef":"WHOSE_MARGIN/result/defer","observation":"증산을 미룬 분기는 필수 공급과 다음 아침 경로에 남은 연속 열여유를 기록한다."}],"gapEvidence":[]},{"cellId":"TP-A4","label":"EXCELLENT","confidence":"HIGH","strengthEvidence":[{"sourceRef":"LONGEST_NIGHT/briefing","observation":"2.6 MW 산업 약속의 유지·연기, 필수 공급 여유, 다음 경계 보호정지와 복합 상실을 하나의 명시적 최종 선택으로 묶는다."},{"sourceRef":"LONGEST_NIGHT/result/keep","observation":"약속 유지 결과가 마지막 산업 약속과 필수 공급을 함께 지킨 것으로 분기별로 회수된다."}],"gapEvidence":[]},{"cellId":"TP-P1","label":"EXCELLENT","confidence":"HIGH","strengthEvidence":[{"sourceRef":"chapter:SECOND_HEART:learningIntent","observation":"둘째 장에서 첫 장의 건설·조작 순서는 제거하고 경로시험 안내만 유지한다고 명시한다."},{"sourceRef":"SECOND_SOURCE/result/standard","observation":"셋째 장 종료 뒤 조작·경로시험 안내를 끝내되 장 목표, 필수 의무, 도시 약속과 다음 경계 예보는 계속 제공한다고 경계를 분명히 한다."}],"gapEvidence":[]},{"cellId":"TP-P2","label":"EXCELLENT","confidence":"HIGH","strengthEvidence":[{"sourceRef":"chapter:NORTH_BANK_PROMISE:learningIntent","observation":"4장은 연결 가능 범위와 실제 공급을 구분하고 현재 공사가 다음 장의 분기 공간과 열여유를 남긴다는 본편 전환을 만든다."},{"sourceRef":"chapter:WHOSE_MARGIN:learningIntent","observation":"5장은 연속 한계, 비상 열여유와 다음 국면 보호정지를 연속 판단으로 확장한다."},{"sourceRef":"chapter:BEFORE_WATER_REACHES:learningIntent","observation":"6장은 기한, 범람 상실, 비상 한계와 보강선 연속 여유를 추가한다."},{"sourceRef":"chapter:SHUT_DOWN_TO_KEEP:learningIntent","observation":"7장은 장시간 뒤 열 상태 초기화와 계획정지 중 남은 전원·경로만의 운용으로 조건을 다시 변형한다."}],"gapEvidence":[]},{"cellId":"TP-P3","label":"EXCELLENT","confidence":"HIGH","strengthEvidence":[{"sourceRef":"chapter:LONGEST_NIGHT:choiceIntent","observation":"최종 선택과 실제 공급 경로가 결과와 에필로그의 누적 운영 기록으로 회수되도록 계획되어 있다."},{"sourceRef":"campaign/epilogue","observation":"에필로그가 여덟 임무의 의무·약속·망·비상 운전·자금을 누적 기록으로 정리하고 다른 시작 상태의 재시험으로 연결한다."}],"gapEvidence":[]},{"cellId":"TP-K1","label":"STRONG","confidence":"HIGH","strengthEvidence":[{"sourceRef":"FIRST_LIGHT/briefing","observation":"접속점 선택부터 통전 확인까지의 순서와 강 위 배치 금지를 짧은 명령형 한국어로 전달한다."},{"sourceRef":"SECOND_HEART/briefing","observation":"반복 안내의 철회와 회랑 차단시험의 성공 조건을 자연스럽고 직접적인 한국어로 설명한다."}],"gapEvidence":[{"sourceRef":"FIRST_LIGHT/briefing","observation":"접속점, 선로 계획, 공사 승인, 통전 같은 조작 용어의 화면상 명칭이나 짧은 정의는 본문에 없다."}]},{"cellId":"TP-K2","label":"SERVICEABLE","confidence":"HIGH","strengthEvidence":[{"sourceRef":"SECOND_SOURCE/window/SECOND_SOURCE_BUILD","observation":"접속부 병목과 실제 경로·최소 열여유의 확인 대상을 간결한 운용 한국어로 표현한다."},{"sourceRef":"SHUT_DOWN_TO_KEEP/result/defer","observation":"미룬 약속과 정비 중 지킨 필수 경로를 결과 문장 하나로 분명히 구분한다."}],"gapEvidence":[{"sourceRef":"chapter:BEFORE_WATER_REACHES:learningIntent","observation":"실패 뒤 우회 계획을 회복한다고 계획하지만 실패 또는 오류 상황에 표시할 별도의 작성 문구는 없다."},{"sourceRef":"BEFORE_WATER_REACHES/briefing","observation":"공개된 비상 한계, 다음 보호정지, 보강선의 연속 여유를 한 문장에 겹쳐 운용 문구의 밀도가 높다."}]},{"cellId":"TP-K3","label":"STRONG","confidence":"HIGH","strengthEvidence":[{"sourceRef":"WHOSE_MARGIN/briefing","observation":"‘더운 저녁의 여유는 한 번만 쓸 수 있습니다’라는 제목이 기술적 제약을 도시 약속의 언어로 선명하게 바꾼다."},{"sourceRef":"campaign/epilogue","observation":"에필로그가 누적 운영 기록과 재시험 가능성을 자연스러운 인계 문맥으로 정리한다."}],"gapEvidence":[{"sourceRef":"campaign/epilogue","observation":"마지막 본문은 기록 항목과 재시험 기능에 집중해 인물이나 도시의 변화에 대한 서사적 마무리는 짧다."}]}]}
