{"protocol":"GRIDWORKS-COMMERCIAL-UX-TEXT-PLAN-JUDGMENT-v1","judgeRunId":"candidate-text-v2-sol-ultra-j02","judgeSlot":"SOL-ULTRA","model":"gpt-5.6-sol","reasoningEffort":"ultra","textPlanSha256":"sha256:8e63340c123862d827e5c85926cbd6ac868eac93308a40f5825fe4b9ff37315c","promptTemplateSha256":"sha256:d31481546619063fcba5193d7c9043c5bb7e620d258ad3a6bc726fead6ff3be9","judgmentSchemaSha256":"sha256:69eb5143bc4821b14b90aa479da21620ddfffb20b63070d580184dfe35e69c04","cells":[{"cellId":"TP-J1","label":"EXCELLENT","confidence":"HIGH","strengthEvidence":[{"sourceRef":"chapter:FIRST_LIGHT:learningIntent","observation":"The arc opens with the full construction and energization sequence."},{"sourceRef":"chapter:LONGEST_NIGHT:learningIntent","observation":"The finale explicitly recombines prior network, promise, thermal, outage, and flood lessons."}],"gapEvidence":[]},{"cellId":"TP-J2","label":"EXCELLENT","confidence":"HIGH","strengthEvidence":[{"sourceRef":"LONGEST_NIGHT/result/keep","observation":"The finale result records the fulfilled promise and the actual grid that survived the compound crisis."},{"sourceRef":"campaign/epilogue","observation":"The epilogue preserves eight-mission outcomes and explicitly offers replay from a chosen chapter start state."}],"gapEvidence":[]},{"cellId":"TP-T1","label":"STRONG","confidence":"HIGH","strengthEvidence":[{"sourceRef":"chapter:FIRST_LIGHT:learningIntent","observation":"The plan names connection selection, line planning, approval, energization, free placement, limits, and state transition."},{"sourceRef":"chapter:FIRST_LIGHT:choiceIntent","observation":"It also includes correcting bad placement and draft plans before approval."}],"gapEvidence":[{"sourceRef":"FIRST_LIGHT/briefing","observation":"The authored briefing promises stepwise guidance but does not specify the individual feedback beats for mistakes or limit violations."}]},{"cellId":"TP-T2","label":"EXCELLENT","confidence":"HIGH","strengthEvidence":[{"sourceRef":"SECOND_HEART/briefing","observation":"It clearly withdraws repeated construction guidance while retaining focused route-test guidance for two sequential corridor outages."},{"sourceRef":"SECOND_HEART/result/standard","observation":"The result closes the lesson by recording the path that remained in each test."}],"gapEvidence":[]},{"cellId":"TP-T3","label":"EXCELLENT","confidence":"HIGH","strengthEvidence":[{"sourceRef":"SECOND_SOURCE/window/SECOND_SOURCE_BUILD","observation":"The plan directly contrasts spare generation with a path constrained by its first saturated connection."},{"sourceRef":"SECOND_SOURCE/result/standard","observation":"It explicitly ends construction and route-test guidance while preserving goals, obligations, promises, and forecasts."}],"gapEvidence":[]},{"cellId":"TP-C1","label":"EXCELLENT","confidence":"HIGH","strengthEvidence":[{"sourceRef":"FIRST_LIGHT/briefing","observation":"The first path has concrete endpoints, a river-placement constraint, and an explicit build-to-supply objective."},{"sourceRef":"FIRST_LIGHT/result/standard","observation":"The result confirms energization and establishes that the built route persists into later work."}],"gapEvidence":[]},{"cellId":"TP-C2","label":"EXCELLENT","confidence":"HIGH","strengthEvidence":[{"sourceRef":"chapter:SECOND_HEART:choiceIntent","observation":"The plan states the cost-versus-independence trade-off between shared and separate corridors."},{"sourceRef":"SECOND_HEART/briefing","observation":"Sequential North Bank and riverside closures make corridor independence operationally concrete."}],"gapEvidence":[]},{"cellId":"TP-C3","label":"EXCELLENT","confidence":"HIGH","strengthEvidence":[{"sourceRef":"chapter:SECOND_SOURCE:learningIntent","observation":"It explicitly states that supply depends on the whole source-to-load path and its smallest connection capacity, not generation alone."},{"sourceRef":"SECOND_SOURCE/window/SECOND_SOURCE_BUILD","observation":"The player is directed to inspect both facilities' actual paths and minimum thermal margin."}],"gapEvidence":[]},{"cellId":"TP-C4","label":"EXCELLENT","confidence":"HIGH","strengthEvidence":[{"sourceRef":"WHOSE_MARGIN/window/AFTER_HEAT_SAFETY","observation":"Emergency operation leads directly to protective shutdown and a surviving-path check."},{"sourceRef":"BEFORE_WATER_REACHES/briefing","observation":"Flood loss, emergency limits, reinforced continuous margin, and the next shutdown are presented together."},{"sourceRef":"SHUT_DOWN_TO_KEEP/briefing","observation":"A three-week reset and planned western-source outage cleanly extend the model into maintenance."}],"gapEvidence":[]},{"cellId":"TP-C5","label":"EXCELLENT","confidence":"HIGH","strengthEvidence":[{"sourceRef":"LONGEST_NIGHT/result/keep","observation":"The keep result resolves emergency operation, shutdown, flood, essential supply, and the final promise together."},{"sourceRef":"LONGEST_NIGHT/result/defer","observation":"The defer result supplies a distinct resolution centered on essential services."}],"gapEvidence":[]},{"cellId":"TP-A1","label":"STRONG","confidence":"HIGH","strengthEvidence":[{"sourceRef":"chapter:FIRST_LIGHT:choiceIntent","observation":"The initial route choice explicitly combines river avoidance with construction cost and time."},{"sourceRef":"chapter:BEFORE_WATER_REACHES:choiceIntent","observation":"A later choice sharply contrasts a short risky reinforcement with a costlier or longer safe corridor."}],"gapEvidence":[{"sourceRef":"BEFORE_WATER_REACHES/briefing","observation":"The player-facing briefing explains risk and capacity but leaves the relative cost and duration consequences unstated."}]},{"cellId":"TP-A2","label":"EXCELLENT","confidence":"HIGH","strengthEvidence":[{"sourceRef":"NORTH_BANK_PROMISE/briefing","observation":"The choice is bounded by mandatory water supply and the need to preserve margin for the next hot evening."},{"sourceRef":"NORTH_BANK_PROMISE/result/defer","observation":"The defer branch explicitly carries the remaining network and funds into the next chapter."}],"gapEvidence":[]},{"cellId":"TP-A3","label":"EXCELLENT","confidence":"HIGH","strengthEvidence":[{"sourceRef":"WHOSE_MARGIN/briefing","observation":"The promise decision clearly trades one-use emergency margin against a known next-boundary shutdown."},{"sourceRef":"WHOSE_MARGIN/result/keep","observation":"The keep result records the actual emergency equipment, subsequent shutdown, and remaining morning path."},{"sourceRef":"WHOSE_MARGIN/result/defer","observation":"The defer result records preserved continuous margin and the surviving next-morning path."}],"gapEvidence":[]},{"cellId":"TP-A4","label":"EXCELLENT","confidence":"HIGH","strengthEvidence":[{"sourceRef":"LONGEST_NIGHT/briefing","observation":"The finale gives the industrial promise a concrete 2.6 MW value and states that deferral preserves essential-supply margin."},{"sourceRef":"LONGEST_NIGHT/result/keep","observation":"The fulfilled branch explicitly pays off both essential services and the last industrial promise."}],"gapEvidence":[]},{"cellId":"TP-P1","label":"EXCELLENT","confidence":"HIGH","strengthEvidence":[{"sourceRef":"SECOND_SOURCE/result/standard","observation":"The handoff precisely distinguishes withdrawn construction and route-test guidance from continuing objectives, duties, promises, and forecasts."}],"gapEvidence":[]},{"cellId":"TP-P2","label":"EXCELLENT","confidence":"HIGH","strengthEvidence":[{"sourceRef":"NORTH_BANK_PROMISE/briefing","observation":"Chapter 4 introduces a persistent promise and future thermal-margin consequence."},{"sourceRef":"WHOSE_MARGIN/briefing","observation":"Chapter 5 adds emergency operation and next-boundary protective shutdown."},{"sourceRef":"BEFORE_WATER_REACHES/briefing","observation":"Chapter 6 adds flood-driven asset loss and reinforcement choice."},{"sourceRef":"SHUT_DOWN_TO_KEEP/briefing","observation":"Chapter 7 adds recovery over elapsed time and a planned source outage."}],"gapEvidence":[]},{"cellId":"TP-P3","label":"EXCELLENT","confidence":"HIGH","strengthEvidence":[{"sourceRef":"LONGEST_NIGHT/briefing","observation":"The finale explicitly tests the previously built network and promises across linked heat and storm boundaries."},{"sourceRef":"campaign/epilogue","observation":"The epilogue retains obligations, promises, actual sources and routes, emergency use, and funds as cumulative operating history."}],"gapEvidence":[]},{"cellId":"TP-K1","label":"EXCELLENT","confidence":"HIGH","strengthEvidence":[{"sourceRef":"FIRST_LIGHT/briefing","observation":"The Korean tutorial copy uses direct action verbs and a clear ordered sequence from connection selection through energization."},{"sourceRef":"SECOND_HEART/briefing","observation":"The withdrawal of repeated controls and retention of route-test guidance are stated plainly."}],"gapEvidence":[]},{"cellId":"TP-K2","label":"STRONG","confidence":"HIGH","strengthEvidence":[{"sourceRef":"WHOSE_MARGIN/window/AFTER_HEAT_SAFETY","observation":"Operational state change and the required follow-up path check are concise and actionable."},{"sourceRef":"SHUT_DOWN_TO_KEEP/result/defer","observation":"The result Korean clearly distinguishes the deferred promise from the essential supply that was preserved."}],"gapEvidence":[{"sourceRef":"SECOND_SOURCE/window/SECOND_SOURCE_BUILD","observation":"Terms such as 접속부, 실제 경로, and 최소 열여유 are packed closely without a local plain-language gloss."}]},{"cellId":"TP-K3","label":"EXCELLENT","confidence":"HIGH","strengthEvidence":[{"sourceRef":"LONGEST_NIGHT/result/defer","observation":"The Korean result title and body give the branch a concise, emotionally legible essential-services payoff."},{"sourceRef":"campaign/epilogue","observation":"The epilogue cleanly summarizes accumulated records and explains replay in natural Korean."}],"gapEvidence":[]}]}
